{
  "$schema": "urn:fortress:schema:v1:verified-behavioral-flow-graph",
  "schema_version": 1,
  "project_id": "PF-FORTRESS",
  "certification_source_digest": "sha256:ce83fbb6960918ff1862555c54c88a6d17c7a5ba7149fd63727ecfc25d7f0f0d",
  "certification_digest": "sha256:9b758f9b825495c478656597e1425b7bc63f6f0431b1a8fc4ccadbd1601cbc29",
  "view": "verified",
  "features": [
    {
      "feature": "AF-FORTRESS-AUDIT-0001",
      "feature_requirement_evidence": [
        "sha256:43acd8db160696360b120277b4c2b122c761330d855961a11bf6719b9a559080",
        "sha256:f98f1a55966c28b8055a9c98aca0fabfe168a6bf8020f83bf4a3b5b6397ddaf8"
      ],
      "checkpoints": [
        {
          "id": "CHK-ARCHITECTURE-EVALUATED",
          "intended": true,
          "realized": true,
          "verification": "VERIFIED_STATIC_AND_EXECUTED",
          "evidence_refs": [
            "sha256:f98f1a55966c28b8055a9c98aca0fabfe168a6bf8020f83bf4a3b5b6397ddaf8"
          ]
        },
        {
          "id": "CHK-AUDIT-FAILED",
          "intended": true,
          "realized": true,
          "verification": "VERIFIED_STATIC_AND_EXECUTED",
          "evidence_refs": [
            "sha256:f98f1a55966c28b8055a9c98aca0fabfe168a6bf8020f83bf4a3b5b6397ddaf8"
          ]
        },
        {
          "id": "CHK-AUDIT-INTERPRETED",
          "intended": true,
          "realized": true,
          "verification": "VERIFIED_STATIC_AND_EXECUTED",
          "evidence_refs": [
            "sha256:f98f1a55966c28b8055a9c98aca0fabfe168a6bf8020f83bf4a3b5b6397ddaf8"
          ]
        },
        {
          "id": "CHK-AUDIT-PASSED",
          "intended": true,
          "realized": true,
          "verification": "VERIFIED_STATIC_AND_EXECUTED",
          "evidence_refs": [
            "sha256:f98f1a55966c28b8055a9c98aca0fabfe168a6bf8020f83bf4a3b5b6397ddaf8"
          ]
        },
        {
          "id": "CHK-AUDIT-REQUESTED",
          "intended": true,
          "realized": true,
          "verification": "VERIFIED_STATIC_AND_EXECUTED",
          "evidence_refs": [
            "sha256:f98f1a55966c28b8055a9c98aca0fabfe168a6bf8020f83bf4a3b5b6397ddaf8"
          ]
        },
        {
          "id": "CHK-AUDIT-RESULT-CLASSIFIED",
          "intended": true,
          "realized": true,
          "verification": "VERIFIED_STATIC_AND_EXECUTED",
          "evidence_refs": [
            "sha256:f98f1a55966c28b8055a9c98aca0fabfe168a6bf8020f83bf4a3b5b6397ddaf8"
          ]
        },
        {
          "id": "CHK-CONTRACT-ECOSYSTEM-COMPILED",
          "intended": true,
          "realized": true,
          "verification": "VERIFIED_STATIC_AND_EXECUTED",
          "evidence_refs": [
            "sha256:f98f1a55966c28b8055a9c98aca0fabfe168a6bf8020f83bf4a3b5b6397ddaf8"
          ]
        },
        {
          "id": "CHK-IMPLEMENTATION-OBSERVED",
          "intended": true,
          "realized": true,
          "verification": "VERIFIED_STATIC_AND_EXECUTED",
          "evidence_refs": [
            "sha256:f98f1a55966c28b8055a9c98aca0fabfe168a6bf8020f83bf4a3b5b6397ddaf8"
          ]
        },
        {
          "id": "CHK-REPOSITORY-STABILIZED",
          "intended": true,
          "realized": true,
          "verification": "VERIFIED_STATIC_AND_EXECUTED",
          "evidence_refs": [
            "sha256:f98f1a55966c28b8055a9c98aca0fabfe168a6bf8020f83bf4a3b5b6397ddaf8"
          ]
        },
        {
          "id": "CHK-RULES-EVALUATED",
          "intended": true,
          "realized": true,
          "verification": "VERIFIED_STATIC_AND_EXECUTED",
          "evidence_refs": [
            "sha256:f98f1a55966c28b8055a9c98aca0fabfe168a6bf8020f83bf4a3b5b6397ddaf8"
          ]
        }
      ],
      "edges": [
        {
          "id": "CHK-ARCHITECTURE-EVALUATED->CHK-RULES-EVALUATED",
          "intended": true,
          "realized": true,
          "verification": "VERIFIED_STATIC_AND_EXECUTED",
          "evidence_refs": [
            "sha256:f98f1a55966c28b8055a9c98aca0fabfe168a6bf8020f83bf4a3b5b6397ddaf8"
          ]
        },
        {
          "id": "CHK-AUDIT-INTERPRETED->CHK-REPOSITORY-STABILIZED",
          "intended": true,
          "realized": true,
          "verification": "VERIFIED_STATIC_AND_EXECUTED",
          "evidence_refs": [
            "sha256:f98f1a55966c28b8055a9c98aca0fabfe168a6bf8020f83bf4a3b5b6397ddaf8"
          ]
        },
        {
          "id": "CHK-AUDIT-REQUESTED->CHK-AUDIT-INTERPRETED",
          "intended": true,
          "realized": true,
          "verification": "VERIFIED_STATIC_AND_EXECUTED",
          "evidence_refs": [
            "sha256:f98f1a55966c28b8055a9c98aca0fabfe168a6bf8020f83bf4a3b5b6397ddaf8"
          ]
        },
        {
          "id": "CHK-AUDIT-RESULT-CLASSIFIED->CHK-AUDIT-FAILED",
          "intended": true,
          "realized": true,
          "verification": "VERIFIED_STATIC_AND_EXECUTED",
          "evidence_refs": [
            "sha256:f98f1a55966c28b8055a9c98aca0fabfe168a6bf8020f83bf4a3b5b6397ddaf8"
          ]
        },
        {
          "id": "CHK-AUDIT-RESULT-CLASSIFIED->CHK-AUDIT-PASSED",
          "intended": true,
          "realized": true,
          "verification": "VERIFIED_STATIC_AND_EXECUTED",
          "evidence_refs": [
            "sha256:f98f1a55966c28b8055a9c98aca0fabfe168a6bf8020f83bf4a3b5b6397ddaf8"
          ]
        },
        {
          "id": "CHK-CONTRACT-ECOSYSTEM-COMPILED->CHK-IMPLEMENTATION-OBSERVED",
          "intended": true,
          "realized": true,
          "verification": "VERIFIED_STATIC_AND_EXECUTED",
          "evidence_refs": [
            "sha256:f98f1a55966c28b8055a9c98aca0fabfe168a6bf8020f83bf4a3b5b6397ddaf8"
          ]
        },
        {
          "id": "CHK-IMPLEMENTATION-OBSERVED->CHK-ARCHITECTURE-EVALUATED",
          "intended": true,
          "realized": true,
          "verification": "VERIFIED_STATIC_AND_EXECUTED",
          "evidence_refs": [
            "sha256:f98f1a55966c28b8055a9c98aca0fabfe168a6bf8020f83bf4a3b5b6397ddaf8"
          ]
        },
        {
          "id": "CHK-REPOSITORY-STABILIZED->CHK-CONTRACT-ECOSYSTEM-COMPILED",
          "intended": true,
          "realized": true,
          "verification": "VERIFIED_STATIC_AND_EXECUTED",
          "evidence_refs": [
            "sha256:f98f1a55966c28b8055a9c98aca0fabfe168a6bf8020f83bf4a3b5b6397ddaf8"
          ]
        },
        {
          "id": "CHK-RULES-EVALUATED->CHK-AUDIT-RESULT-CLASSIFIED",
          "intended": true,
          "realized": true,
          "verification": "VERIFIED_STATIC_AND_EXECUTED",
          "evidence_refs": [
            "sha256:f98f1a55966c28b8055a9c98aca0fabfe168a6bf8020f83bf4a3b5b6397ddaf8"
          ]
        }
      ]
    }
  ],
  "summary": {
    "VERIFIED_STATIC_AND_EXECUTED": 19
  },
  "provenance": [
    "Intended, realized, and verification dimensions remain separate.",
    "Feature Requirement tests are not attributed to exact edges without a verification binding."
  ]
}
