{
  "$schema": "urn:fortress:schema:v1:verified-behavioral-flow-graph",
  "schema_version": 1,
  "project_id": "PF-FORTRESS",
  "certification_source_digest": "sha256:ab09e733c8cc63da4176e03792b681e35d75cc5bbffc5b74546f08b9e489710e",
  "certification_digest": "sha256:ce7a0b4cb7b2ebd20840129f2e166e8efebde310ffbf18607acd7d3b54752c7b",
  "view": "verified",
  "features": [
    {
      "feature": "AF-FORTRESS-AUDIT-0001",
      "feature_requirement_evidence": [
        "sha256:47cd9637f23984c7f5ab0400eebf1492d86dbb6145fa25249f1c99e59bf4a9be",
        "sha256:fcbcbc177d230fb683a358ba6faa02ecb92dd21d47f808a4759333d34c06da93"
      ],
      "checkpoints": [
        {
          "id": "CHK-ARCHITECTURE-EVALUATED",
          "intended": true,
          "realized": true,
          "verification": "VERIFIED_STATIC_AND_EXECUTED",
          "evidence_refs": [
            "sha256:fcbcbc177d230fb683a358ba6faa02ecb92dd21d47f808a4759333d34c06da93"
          ]
        },
        {
          "id": "CHK-AUDIT-FAILED",
          "intended": true,
          "realized": true,
          "verification": "VERIFIED_STATIC_AND_EXECUTED",
          "evidence_refs": [
            "sha256:fcbcbc177d230fb683a358ba6faa02ecb92dd21d47f808a4759333d34c06da93"
          ]
        },
        {
          "id": "CHK-AUDIT-INTERPRETED",
          "intended": true,
          "realized": true,
          "verification": "VERIFIED_STATIC_AND_EXECUTED",
          "evidence_refs": [
            "sha256:fcbcbc177d230fb683a358ba6faa02ecb92dd21d47f808a4759333d34c06da93"
          ]
        },
        {
          "id": "CHK-AUDIT-PASSED",
          "intended": true,
          "realized": true,
          "verification": "VERIFIED_STATIC_AND_EXECUTED",
          "evidence_refs": [
            "sha256:fcbcbc177d230fb683a358ba6faa02ecb92dd21d47f808a4759333d34c06da93"
          ]
        },
        {
          "id": "CHK-AUDIT-REQUESTED",
          "intended": true,
          "realized": true,
          "verification": "VERIFIED_STATIC_AND_EXECUTED",
          "evidence_refs": [
            "sha256:fcbcbc177d230fb683a358ba6faa02ecb92dd21d47f808a4759333d34c06da93"
          ]
        },
        {
          "id": "CHK-AUDIT-RESULT-CLASSIFIED",
          "intended": true,
          "realized": true,
          "verification": "VERIFIED_STATIC_AND_EXECUTED",
          "evidence_refs": [
            "sha256:fcbcbc177d230fb683a358ba6faa02ecb92dd21d47f808a4759333d34c06da93"
          ]
        },
        {
          "id": "CHK-CONTRACT-ECOSYSTEM-COMPILED",
          "intended": true,
          "realized": true,
          "verification": "VERIFIED_STATIC_AND_EXECUTED",
          "evidence_refs": [
            "sha256:fcbcbc177d230fb683a358ba6faa02ecb92dd21d47f808a4759333d34c06da93"
          ]
        },
        {
          "id": "CHK-IMPLEMENTATION-OBSERVED",
          "intended": true,
          "realized": true,
          "verification": "VERIFIED_STATIC_AND_EXECUTED",
          "evidence_refs": [
            "sha256:fcbcbc177d230fb683a358ba6faa02ecb92dd21d47f808a4759333d34c06da93"
          ]
        },
        {
          "id": "CHK-REPOSITORY-STABILIZED",
          "intended": true,
          "realized": true,
          "verification": "VERIFIED_STATIC_AND_EXECUTED",
          "evidence_refs": [
            "sha256:fcbcbc177d230fb683a358ba6faa02ecb92dd21d47f808a4759333d34c06da93"
          ]
        },
        {
          "id": "CHK-RULES-EVALUATED",
          "intended": true,
          "realized": true,
          "verification": "VERIFIED_STATIC_AND_EXECUTED",
          "evidence_refs": [
            "sha256:fcbcbc177d230fb683a358ba6faa02ecb92dd21d47f808a4759333d34c06da93"
          ]
        }
      ],
      "edges": [
        {
          "id": "CHK-ARCHITECTURE-EVALUATED->CHK-RULES-EVALUATED",
          "intended": true,
          "realized": true,
          "verification": "VERIFIED_STATIC_AND_EXECUTED",
          "evidence_refs": [
            "sha256:fcbcbc177d230fb683a358ba6faa02ecb92dd21d47f808a4759333d34c06da93"
          ]
        },
        {
          "id": "CHK-AUDIT-INTERPRETED->CHK-REPOSITORY-STABILIZED",
          "intended": true,
          "realized": true,
          "verification": "VERIFIED_STATIC_AND_EXECUTED",
          "evidence_refs": [
            "sha256:fcbcbc177d230fb683a358ba6faa02ecb92dd21d47f808a4759333d34c06da93"
          ]
        },
        {
          "id": "CHK-AUDIT-REQUESTED->CHK-AUDIT-INTERPRETED",
          "intended": true,
          "realized": true,
          "verification": "VERIFIED_STATIC_AND_EXECUTED",
          "evidence_refs": [
            "sha256:fcbcbc177d230fb683a358ba6faa02ecb92dd21d47f808a4759333d34c06da93"
          ]
        },
        {
          "id": "CHK-AUDIT-RESULT-CLASSIFIED->CHK-AUDIT-FAILED",
          "intended": true,
          "realized": true,
          "verification": "VERIFIED_STATIC_AND_EXECUTED",
          "evidence_refs": [
            "sha256:fcbcbc177d230fb683a358ba6faa02ecb92dd21d47f808a4759333d34c06da93"
          ]
        },
        {
          "id": "CHK-AUDIT-RESULT-CLASSIFIED->CHK-AUDIT-PASSED",
          "intended": true,
          "realized": true,
          "verification": "VERIFIED_STATIC_AND_EXECUTED",
          "evidence_refs": [
            "sha256:fcbcbc177d230fb683a358ba6faa02ecb92dd21d47f808a4759333d34c06da93"
          ]
        },
        {
          "id": "CHK-CONTRACT-ECOSYSTEM-COMPILED->CHK-IMPLEMENTATION-OBSERVED",
          "intended": true,
          "realized": true,
          "verification": "VERIFIED_STATIC_AND_EXECUTED",
          "evidence_refs": [
            "sha256:fcbcbc177d230fb683a358ba6faa02ecb92dd21d47f808a4759333d34c06da93"
          ]
        },
        {
          "id": "CHK-IMPLEMENTATION-OBSERVED->CHK-ARCHITECTURE-EVALUATED",
          "intended": true,
          "realized": true,
          "verification": "VERIFIED_STATIC_AND_EXECUTED",
          "evidence_refs": [
            "sha256:fcbcbc177d230fb683a358ba6faa02ecb92dd21d47f808a4759333d34c06da93"
          ]
        },
        {
          "id": "CHK-REPOSITORY-STABILIZED->CHK-CONTRACT-ECOSYSTEM-COMPILED",
          "intended": true,
          "realized": true,
          "verification": "VERIFIED_STATIC_AND_EXECUTED",
          "evidence_refs": [
            "sha256:fcbcbc177d230fb683a358ba6faa02ecb92dd21d47f808a4759333d34c06da93"
          ]
        },
        {
          "id": "CHK-RULES-EVALUATED->CHK-AUDIT-RESULT-CLASSIFIED",
          "intended": true,
          "realized": true,
          "verification": "VERIFIED_STATIC_AND_EXECUTED",
          "evidence_refs": [
            "sha256:fcbcbc177d230fb683a358ba6faa02ecb92dd21d47f808a4759333d34c06da93"
          ]
        }
      ]
    }
  ],
  "summary": {
    "VERIFIED_STATIC_AND_EXECUTED": 19
  },
  "provenance": [
    "Intended, realized, and verification dimensions remain separate.",
    "Feature Requirement tests are not attributed to exact edges without a verification binding."
  ]
}
