{
  "$schema": "urn:fortress:schema:v1:verified-behavioral-flow-graph",
  "schema_version": 1,
  "project_id": "PF-FORTRESS",
  "certification_source_digest": "sha256:08a79a0855aa67f1a1fa43b5c5b66adcf5016d26a941e43500b6e59d6808db07",
  "certification_digest": "sha256:4a2d30487ec6d35d38218a7886fe4d48b367608626c434e17bfaf4b85d390062",
  "view": "verified",
  "features": [
    {
      "feature": "AF-FORTRESS-AUDIT-0001",
      "feature_requirement_evidence": [
        "sha256:1aa9b50e55c66cde2521419bee6abc72543cedb4e8d33ec67d9884e5fc307a2f",
        "sha256:252deb0fae7c4a92bbec50f5438511ead9bf910d10d212f1dd0c957d0fae73e0"
      ],
      "checkpoints": [
        {
          "id": "CHK-ARCHITECTURE-EVALUATED",
          "intended": true,
          "realized": true,
          "verification": "VERIFIED_STATIC_AND_EXECUTED",
          "evidence_refs": [
            "sha256:1aa9b50e55c66cde2521419bee6abc72543cedb4e8d33ec67d9884e5fc307a2f"
          ]
        },
        {
          "id": "CHK-AUDIT-FAILED",
          "intended": true,
          "realized": true,
          "verification": "VERIFIED_STATIC_AND_EXECUTED",
          "evidence_refs": [
            "sha256:1aa9b50e55c66cde2521419bee6abc72543cedb4e8d33ec67d9884e5fc307a2f"
          ]
        },
        {
          "id": "CHK-AUDIT-INTERPRETED",
          "intended": true,
          "realized": true,
          "verification": "VERIFIED_STATIC_AND_EXECUTED",
          "evidence_refs": [
            "sha256:1aa9b50e55c66cde2521419bee6abc72543cedb4e8d33ec67d9884e5fc307a2f"
          ]
        },
        {
          "id": "CHK-AUDIT-PASSED",
          "intended": true,
          "realized": true,
          "verification": "VERIFIED_STATIC_AND_EXECUTED",
          "evidence_refs": [
            "sha256:1aa9b50e55c66cde2521419bee6abc72543cedb4e8d33ec67d9884e5fc307a2f"
          ]
        },
        {
          "id": "CHK-AUDIT-REQUESTED",
          "intended": true,
          "realized": true,
          "verification": "VERIFIED_STATIC_AND_EXECUTED",
          "evidence_refs": [
            "sha256:1aa9b50e55c66cde2521419bee6abc72543cedb4e8d33ec67d9884e5fc307a2f"
          ]
        },
        {
          "id": "CHK-AUDIT-RESULT-CLASSIFIED",
          "intended": true,
          "realized": true,
          "verification": "VERIFIED_STATIC_AND_EXECUTED",
          "evidence_refs": [
            "sha256:1aa9b50e55c66cde2521419bee6abc72543cedb4e8d33ec67d9884e5fc307a2f"
          ]
        },
        {
          "id": "CHK-CONTRACT-ECOSYSTEM-COMPILED",
          "intended": true,
          "realized": true,
          "verification": "VERIFIED_STATIC_AND_EXECUTED",
          "evidence_refs": [
            "sha256:1aa9b50e55c66cde2521419bee6abc72543cedb4e8d33ec67d9884e5fc307a2f"
          ]
        },
        {
          "id": "CHK-IMPLEMENTATION-OBSERVED",
          "intended": true,
          "realized": true,
          "verification": "VERIFIED_STATIC_AND_EXECUTED",
          "evidence_refs": [
            "sha256:1aa9b50e55c66cde2521419bee6abc72543cedb4e8d33ec67d9884e5fc307a2f"
          ]
        },
        {
          "id": "CHK-REPOSITORY-STABILIZED",
          "intended": true,
          "realized": true,
          "verification": "VERIFIED_STATIC_AND_EXECUTED",
          "evidence_refs": [
            "sha256:1aa9b50e55c66cde2521419bee6abc72543cedb4e8d33ec67d9884e5fc307a2f"
          ]
        },
        {
          "id": "CHK-RULES-EVALUATED",
          "intended": true,
          "realized": true,
          "verification": "VERIFIED_STATIC_AND_EXECUTED",
          "evidence_refs": [
            "sha256:1aa9b50e55c66cde2521419bee6abc72543cedb4e8d33ec67d9884e5fc307a2f"
          ]
        }
      ],
      "edges": [
        {
          "id": "CHK-ARCHITECTURE-EVALUATED->CHK-RULES-EVALUATED",
          "intended": true,
          "realized": true,
          "verification": "VERIFIED_STATIC_AND_EXECUTED",
          "evidence_refs": [
            "sha256:1aa9b50e55c66cde2521419bee6abc72543cedb4e8d33ec67d9884e5fc307a2f"
          ]
        },
        {
          "id": "CHK-AUDIT-INTERPRETED->CHK-REPOSITORY-STABILIZED",
          "intended": true,
          "realized": true,
          "verification": "VERIFIED_STATIC_AND_EXECUTED",
          "evidence_refs": [
            "sha256:1aa9b50e55c66cde2521419bee6abc72543cedb4e8d33ec67d9884e5fc307a2f"
          ]
        },
        {
          "id": "CHK-AUDIT-REQUESTED->CHK-AUDIT-INTERPRETED",
          "intended": true,
          "realized": true,
          "verification": "VERIFIED_STATIC_AND_EXECUTED",
          "evidence_refs": [
            "sha256:1aa9b50e55c66cde2521419bee6abc72543cedb4e8d33ec67d9884e5fc307a2f"
          ]
        },
        {
          "id": "CHK-AUDIT-RESULT-CLASSIFIED->CHK-AUDIT-FAILED",
          "intended": true,
          "realized": true,
          "verification": "VERIFIED_STATIC_AND_EXECUTED",
          "evidence_refs": [
            "sha256:1aa9b50e55c66cde2521419bee6abc72543cedb4e8d33ec67d9884e5fc307a2f"
          ]
        },
        {
          "id": "CHK-AUDIT-RESULT-CLASSIFIED->CHK-AUDIT-PASSED",
          "intended": true,
          "realized": true,
          "verification": "VERIFIED_STATIC_AND_EXECUTED",
          "evidence_refs": [
            "sha256:1aa9b50e55c66cde2521419bee6abc72543cedb4e8d33ec67d9884e5fc307a2f"
          ]
        },
        {
          "id": "CHK-CONTRACT-ECOSYSTEM-COMPILED->CHK-IMPLEMENTATION-OBSERVED",
          "intended": true,
          "realized": true,
          "verification": "VERIFIED_STATIC_AND_EXECUTED",
          "evidence_refs": [
            "sha256:1aa9b50e55c66cde2521419bee6abc72543cedb4e8d33ec67d9884e5fc307a2f"
          ]
        },
        {
          "id": "CHK-IMPLEMENTATION-OBSERVED->CHK-ARCHITECTURE-EVALUATED",
          "intended": true,
          "realized": true,
          "verification": "VERIFIED_STATIC_AND_EXECUTED",
          "evidence_refs": [
            "sha256:1aa9b50e55c66cde2521419bee6abc72543cedb4e8d33ec67d9884e5fc307a2f"
          ]
        },
        {
          "id": "CHK-REPOSITORY-STABILIZED->CHK-CONTRACT-ECOSYSTEM-COMPILED",
          "intended": true,
          "realized": true,
          "verification": "VERIFIED_STATIC_AND_EXECUTED",
          "evidence_refs": [
            "sha256:1aa9b50e55c66cde2521419bee6abc72543cedb4e8d33ec67d9884e5fc307a2f"
          ]
        },
        {
          "id": "CHK-RULES-EVALUATED->CHK-AUDIT-RESULT-CLASSIFIED",
          "intended": true,
          "realized": true,
          "verification": "VERIFIED_STATIC_AND_EXECUTED",
          "evidence_refs": [
            "sha256:1aa9b50e55c66cde2521419bee6abc72543cedb4e8d33ec67d9884e5fc307a2f"
          ]
        }
      ]
    }
  ],
  "summary": {
    "VERIFIED_STATIC_AND_EXECUTED": 19
  },
  "provenance": [
    "Intended, realized, and verification dimensions remain separate.",
    "Feature Requirement tests are not attributed to exact edges without a verification binding."
  ]
}
