{
  "$schema": "urn:fortress:schema:v1:verified-behavioral-flow-graph",
  "schema_version": 1,
  "project_id": "PF-FORTRESS",
  "certification_source_digest": "sha256:306ad90eee121f847b06f716b532b8c2252107c4d56bc6695a1e8088d7786da7",
  "certification_digest": "sha256:6f0869e2f85c63d1145fea6c53f76c1d466d68e2e82b3d242c51b4baf9d37ef9",
  "view": "verified",
  "features": [
    {
      "feature": "AF-FORTRESS-AUDIT-0001",
      "feature_requirement_evidence": [
        "sha256:c2042e47c80af91c3da87dea012e8324ea74ab5144394ea0d11616eed440567b",
        "sha256:d9856f7166ad5c0c9eb944835c078c586fdd8f3029ed3412bf74f2dc1f740c1f"
      ],
      "checkpoints": [
        {
          "id": "CHK-ARCHITECTURE-EVALUATED",
          "intended": true,
          "realized": true,
          "verification": "VERIFIED_STATIC_AND_EXECUTED",
          "evidence_refs": [
            "sha256:d9856f7166ad5c0c9eb944835c078c586fdd8f3029ed3412bf74f2dc1f740c1f"
          ]
        },
        {
          "id": "CHK-AUDIT-FAILED",
          "intended": true,
          "realized": true,
          "verification": "VERIFIED_STATIC_AND_EXECUTED",
          "evidence_refs": [
            "sha256:d9856f7166ad5c0c9eb944835c078c586fdd8f3029ed3412bf74f2dc1f740c1f"
          ]
        },
        {
          "id": "CHK-AUDIT-INTERPRETED",
          "intended": true,
          "realized": true,
          "verification": "VERIFIED_STATIC_AND_EXECUTED",
          "evidence_refs": [
            "sha256:d9856f7166ad5c0c9eb944835c078c586fdd8f3029ed3412bf74f2dc1f740c1f"
          ]
        },
        {
          "id": "CHK-AUDIT-PASSED",
          "intended": true,
          "realized": true,
          "verification": "VERIFIED_STATIC_AND_EXECUTED",
          "evidence_refs": [
            "sha256:d9856f7166ad5c0c9eb944835c078c586fdd8f3029ed3412bf74f2dc1f740c1f"
          ]
        },
        {
          "id": "CHK-AUDIT-REQUESTED",
          "intended": true,
          "realized": true,
          "verification": "VERIFIED_STATIC_AND_EXECUTED",
          "evidence_refs": [
            "sha256:d9856f7166ad5c0c9eb944835c078c586fdd8f3029ed3412bf74f2dc1f740c1f"
          ]
        },
        {
          "id": "CHK-AUDIT-RESULT-CLASSIFIED",
          "intended": true,
          "realized": true,
          "verification": "VERIFIED_STATIC_AND_EXECUTED",
          "evidence_refs": [
            "sha256:d9856f7166ad5c0c9eb944835c078c586fdd8f3029ed3412bf74f2dc1f740c1f"
          ]
        },
        {
          "id": "CHK-CONTRACT-ECOSYSTEM-COMPILED",
          "intended": true,
          "realized": true,
          "verification": "VERIFIED_STATIC_AND_EXECUTED",
          "evidence_refs": [
            "sha256:d9856f7166ad5c0c9eb944835c078c586fdd8f3029ed3412bf74f2dc1f740c1f"
          ]
        },
        {
          "id": "CHK-IMPLEMENTATION-OBSERVED",
          "intended": true,
          "realized": true,
          "verification": "VERIFIED_STATIC_AND_EXECUTED",
          "evidence_refs": [
            "sha256:d9856f7166ad5c0c9eb944835c078c586fdd8f3029ed3412bf74f2dc1f740c1f"
          ]
        },
        {
          "id": "CHK-REPOSITORY-STABILIZED",
          "intended": true,
          "realized": true,
          "verification": "VERIFIED_STATIC_AND_EXECUTED",
          "evidence_refs": [
            "sha256:d9856f7166ad5c0c9eb944835c078c586fdd8f3029ed3412bf74f2dc1f740c1f"
          ]
        },
        {
          "id": "CHK-RULES-EVALUATED",
          "intended": true,
          "realized": true,
          "verification": "VERIFIED_STATIC_AND_EXECUTED",
          "evidence_refs": [
            "sha256:d9856f7166ad5c0c9eb944835c078c586fdd8f3029ed3412bf74f2dc1f740c1f"
          ]
        }
      ],
      "edges": [
        {
          "id": "CHK-ARCHITECTURE-EVALUATED->CHK-RULES-EVALUATED",
          "intended": true,
          "realized": true,
          "verification": "VERIFIED_STATIC_AND_EXECUTED",
          "evidence_refs": [
            "sha256:d9856f7166ad5c0c9eb944835c078c586fdd8f3029ed3412bf74f2dc1f740c1f"
          ]
        },
        {
          "id": "CHK-AUDIT-INTERPRETED->CHK-REPOSITORY-STABILIZED",
          "intended": true,
          "realized": true,
          "verification": "VERIFIED_STATIC_AND_EXECUTED",
          "evidence_refs": [
            "sha256:d9856f7166ad5c0c9eb944835c078c586fdd8f3029ed3412bf74f2dc1f740c1f"
          ]
        },
        {
          "id": "CHK-AUDIT-REQUESTED->CHK-AUDIT-INTERPRETED",
          "intended": true,
          "realized": true,
          "verification": "VERIFIED_STATIC_AND_EXECUTED",
          "evidence_refs": [
            "sha256:d9856f7166ad5c0c9eb944835c078c586fdd8f3029ed3412bf74f2dc1f740c1f"
          ]
        },
        {
          "id": "CHK-AUDIT-RESULT-CLASSIFIED->CHK-AUDIT-FAILED",
          "intended": true,
          "realized": true,
          "verification": "VERIFIED_STATIC_AND_EXECUTED",
          "evidence_refs": [
            "sha256:d9856f7166ad5c0c9eb944835c078c586fdd8f3029ed3412bf74f2dc1f740c1f"
          ]
        },
        {
          "id": "CHK-AUDIT-RESULT-CLASSIFIED->CHK-AUDIT-PASSED",
          "intended": true,
          "realized": true,
          "verification": "VERIFIED_STATIC_AND_EXECUTED",
          "evidence_refs": [
            "sha256:d9856f7166ad5c0c9eb944835c078c586fdd8f3029ed3412bf74f2dc1f740c1f"
          ]
        },
        {
          "id": "CHK-CONTRACT-ECOSYSTEM-COMPILED->CHK-IMPLEMENTATION-OBSERVED",
          "intended": true,
          "realized": true,
          "verification": "VERIFIED_STATIC_AND_EXECUTED",
          "evidence_refs": [
            "sha256:d9856f7166ad5c0c9eb944835c078c586fdd8f3029ed3412bf74f2dc1f740c1f"
          ]
        },
        {
          "id": "CHK-IMPLEMENTATION-OBSERVED->CHK-ARCHITECTURE-EVALUATED",
          "intended": true,
          "realized": true,
          "verification": "VERIFIED_STATIC_AND_EXECUTED",
          "evidence_refs": [
            "sha256:d9856f7166ad5c0c9eb944835c078c586fdd8f3029ed3412bf74f2dc1f740c1f"
          ]
        },
        {
          "id": "CHK-REPOSITORY-STABILIZED->CHK-CONTRACT-ECOSYSTEM-COMPILED",
          "intended": true,
          "realized": true,
          "verification": "VERIFIED_STATIC_AND_EXECUTED",
          "evidence_refs": [
            "sha256:d9856f7166ad5c0c9eb944835c078c586fdd8f3029ed3412bf74f2dc1f740c1f"
          ]
        },
        {
          "id": "CHK-RULES-EVALUATED->CHK-AUDIT-RESULT-CLASSIFIED",
          "intended": true,
          "realized": true,
          "verification": "VERIFIED_STATIC_AND_EXECUTED",
          "evidence_refs": [
            "sha256:d9856f7166ad5c0c9eb944835c078c586fdd8f3029ed3412bf74f2dc1f740c1f"
          ]
        }
      ]
    }
  ],
  "summary": {
    "VERIFIED_STATIC_AND_EXECUTED": 19
  },
  "provenance": [
    "Intended, realized, and verification dimensions remain separate.",
    "Feature Requirement tests are not attributed to exact edges without a verification binding."
  ]
}
